"Section:PL-Right-of-Way and Utilities, GIS Integration (8 Reqs)"
716386,Medium,,Provide a full featured GIS viewer within the right-of-way and utilities function which integrates with WVDOT's existing ESRI  ArcGIS environment.
716387,Medium,,Provide the ability to display one or more parcels or required utility relocations on a project meeting specific user defined criteria  on a map from within the GIS viewer in the ERP right-of-way and utilities function.
716388,Medium,,"Provide the capability to spatially map a specific parcel or utility relocation or set of parcels or utility relocations meeting a user  defined set of criteria from within the right-of-way and utilities function. While looking at a list of parcels or utility relocations or  detailed information about an individual parcel or utility relocation, the user must be able to select ""map"" and see the location of  the parcel or utility relocation displayed spatially by the GIS viewer within the ERP right-of-way and utilities function."
716389,Medium,,Provide the capability to enter a set of selection criteria for any pre-defined report and request that the results be displayed  spatially by the GIS viewer within the right-of-way and utilities function.
716390,Medium,,Provide the capability to enter a set of selection criteria for an ad-hoc query of parcel or utility relocation information and request  that the results be displayed spatially by the GIS viewer within the right-of-way and utilities function.
716391,Medium,,Provide the ability to select a parcel or utility relocation from a map in the GIS viewer within the ERP right-of-way and utilities  function and drill down to see detailed information about the parcel or utility relocation within the ERP right-of-way and utilities  function.
716392,Medium,,Provide the ability for a user to select an area of interest from within WVDOT's GIS application and request that all parcels or  utility relocations in that area meeting certain user defined criteria stored in the ERP right-of-way and utilities function be spatially  displayed on a map within WVDOT's GIS.
716393,Medium,,Provide the ability to select one or more parcels or utility relocations from a map within an area displayed in the WVDOT GIS  application and drill down to see the detailed information about the specific parcel or parcels within the ERP right-of-way and  utilities function.
